uid,title,url,image,contenttype,serie,year,normalized,characters,firstparagraph,allpixels,paperpixels,paintedpixels,description,country,duration,seconds,mp3,interviews
t-241,Una mayor diversidad de plantas en techos verdes favorece la diversidad de insectos benéficos,https://unciencia.unc.edu.ar/biologia/una-mayor-diversidad-de-plantas-en-techos-verdes-favorece-la-diversidad-de-insectos-beneficos/,https://unciencia.unc.edu.ar/wp-content/blogs.dir/31/files/sites/4/2021/05/UNCiencia_techos-verdes_insectos-ben%C3%A9ficos-01-1920-1920x944-c-default.jpg,Artículos,Biología,2021,0.307082,8091.0,Un estudio indagó qué características deberían tener estas “islas verdes” para ser más eficientes y promover la proliferación de artrópodos beneficiosos. Estos invertebrados brindan una serie de servicios ecosistémicos fundamentales&#x2c; como la polinización&#x2c; el control de plagas&#x2c; la descomposición y la estabilización del sustrato. El equipo de investigación analizó 30 techos verdes&#x2c; donde hallaron 116 especies de plantas y capturaron más de doce mil insectos y otros artrópodos. Este tipo de cobertura forma parte del código de edificación de la ciudad de Córdoba y constituye un punto fundamental para el desarrollo urbanístico sustentable. Es el primer trabajo de su tipo en Sudamérica. [12.05.2021],,,,,,,,,
t-242,"Basta analizar los retuiteos dentro de la hora posterior a su publicación, para saber si un tuit será trending topic",https://unciencia.unc.edu.ar/computacion/basta-analizar-los-retuiteos-dentro-de-la-hora-posterior-a-su-publicacion-para-saber-si-un-tuit-sera-trending-topic/,https://unciencia.unc.edu.ar/wp-content/blogs.dir/31/files/sites/4/2021/05/UNCiencia-twitter-predicciones-de-impacto-01-1920-1024x503.jpg,Artículos,Computación,2021,0.173713,4577.0,El grupo de Análisis y Procesamiento de Grandes Redes Sociales y Semánticas de la FaMAF-UNC analizó 9&#x2c;5 millones de tuits. Centrándose en las conexiones sociales entre casi cuatro mil usuarias y  usuarios&#x2c; determinó que la primera hora de actividad de un posteo permite saber&#x2c; con un 70% de efectividad&#x2c; si será popular. Esta detección temprana posibilita&#x2c; por ejemplo&#x2c; crear contranarrativas que frenen el alcance de las fake news. [05.05.2021],,,,,,,,,
t-243,Qué podemos aprender de las hormigas para protegernos del coronavirus,https://unciencia.unc.edu.ar/curiosidades/que-podemos-aprender-de-las-hormigas-para-protegernos-del-coronavirus/,https://unciencia.unc.edu.ar/wp-content/blogs.dir/31/files/sites/4/2021/04/UNCiencia_que-podemos-aprender-de-las-hormigas-01-1920-1024x503.jpg,Artículos,Curiosidades,2021,0.294861,7769.0,Difícilmente alguien se haya imaginado atravesando una pandemia en el transcurso de su vida. Sin embargo&#x2c; en Argentina el número de personas infectadas con coronavirus ya superó los 2&#x2c;9 millones a fines de abril. Los virus y otros patógenos dependen exclusivamente de sus huéspedes para sobrevivir. Cuanto más próximo y estrecho es el contacto entre sus posibles hospedadores&#x2c; más posibilidades tienen de diseminarse de manera exitosa. Somos seres sociales y gracias al modo de vida actual&#x2c; patógenos como el SARS-CoV-2 tienen altas posibilidades de propagarse. Ahora bien&#x2c; ¿Cómo hacen otros seres sociales para lidiar con esto? ¿Cómo se las arreglan los animales sociales sin barbijos? [29.04.2021],,,,,,,,,
t-244,Identificarán cuáles son las zonas más calientes y con más mosquitos de la ciudad,https://unciencia.unc.edu.ar/biologia/identificaran-cuales-son-las-zonas-mas-calientes-y-con-mas-mosquitos-de-la-ciudad/,https://unciencia.unc.edu.ar/wp-content/blogs.dir/31/files/sites/4/2021/04/UNCiencia-trampas-para-mosquitos-01-1920-1024x503.jpg,Artículos,Biología,2021,0.310877,8191.0,Un estudio en desarrollo financiado por la National Geographic y realizado por especialistas de la UNC y el Conicet permitirá detectar cuáles son las zonas de la ciudad de Córdoba con mayor temperatura y diversidad de mosquitos&#x2c; entre ellos&#x2c; el transmisor del virus del dengue. A mediados de abril colocaron 60 trampas en 30 sitios distribuidos en toda ciudad&#x2c; y repetirán el muestreo en mayo. En las áreas más calurosas&#x2c; esperan encontrar menos diversidad de mosquitos&#x2c; pero mayor presencia de especies peligrosas para la salud humana. [27.04.2021],,,,,,,,,
t-245,Hallan un cóctel de antibióticos en peces que se venden para consumo en Córdoba,https://unciencia.unc.edu.ar/quimica/hallan-un-coctel-de-antibioticos-en-peces-que-se-venden-para-consumo-en-cordoba/,https://unciencia.unc.edu.ar/wp-content/blogs.dir/31/files/sites/4/2021/04/UNCiencia_antibioticos-en-pescado-de-criadero-01-1920-1024x503.jpg,Artículos,Química,2021,0.379991,10012.0,Un estudio detectó residuos de 42 fármacos en muestras de diferentes especies ofrecidas en comercios de la capital provincial. Las sustancias encontradas se utilizan para tratar enfermedades infecciosas en animales y en humanos. El uso de algunas está prohibido en criaderos. Si bien los niveles registrados están dentro de los límites de las dosis diarias que una persona puede ingerir&#x2c; de acuerdo a la normativa de referencia&#x2c; se carece de información suficiente sobre su efecto a largo plazo. El trabajo fue realizado en el Departamento de Bioquímica Clínica de la Facultad de Ciencias Químicas (UNC) y el Centro de Investigaciones en Bioquímica Clínica e Inmunología (Cibici – UNC/Conicet). [15.04.2021],,,,,,,,,
t-246,Etiquetado frontal de alimentos: una medida para garantizar un derecho humano fundamental,https://unciencia.unc.edu.ar/derecho/etiquetado-frontal-de-alimentos-una-medida-para-garantizar-un-derecho-humano-fundamental/,https://unciencia.unc.edu.ar/wp-content/blogs.dir/31/files/sites/4/2021/04/UNCiencia_etiquetado-frontal-de-alimentos-01-1920-1024x503.jpg,Artículos,Derecho,2021,0.562054,14809.0,El Senado de la Nación ya dio media sanción al proyecto de ley&#x2c; que ahora es analizado en cuatro comisiones de Diputados. Entre otros aspectos&#x2c; prevé que los productos de consumo incluyan un sistema de advertencia –bajo la forma de octógonos negros– con la leyenda “exceso en…”. En Argentina&#x2c; siete de cada diez personas adultas y cuatro de cada diez niños&#x2c; niñas y adolescentes tienen malnutrición por exceso de consumo. En esta nota&#x2c; los motivos jurídicos por los cuales el proyecto es fundamental para proteger los derechos constitucionales a la salud&#x2c; a la alimentación adecuada y los derechos del consumidor. [08.04.2021],,,,,,,,,
t-247,"Con inteligencia artificial, logran generar automáticamente informes médicos a partir de radiografías",https://unciencia.unc.edu.ar/innovacion/con-inteligencia-artificial-logran-generar-automaticamente-informes-medicos-a-partir-de-radiografias/,https://unciencia.unc.edu.ar/wp-content/blogs.dir/31/files/sites/4/2021/03/UNCiencia-reportes-medicos-IA-1920-1024x504.jpg,Artículos,Innovación,2021,0.26818,7066.0,Utilizando un sistema de redes neuronales&#x2c; un egresado de la carrera Ciencias de la Computación de la UNC logró implementar un modelo neuronal capaz de describir textualmente imágenes médicas. Se trata de un logro importante para la medicina&#x2c; ya que la redacción de los informes es un proceso repetitivo y consume gran parte de la jornada laboral del equipo de profesionales en la salud. El desarrollo permitiría reducir notablemente el tiempo dedicado a esa tarea y optimizar la atención de los pacientes. [31.03.2021],,,,,,,,,
t-248,Literatura posdictadura: la herencia inevitable para la generación de hijas e hijos,https://unciencia.unc.edu.ar/literatura/literatura-posdictadura-la-herencia-inevitable-para-la-generacion-de-hijas-e-hijos/,https://unciencia.unc.edu.ar/wp-content/blogs.dir/31/files/sites/4/2021/03/UNCiencia_Literatura-pos-dictadura-03-1920-1024x503.jpg,Artículos,Literatura,2021,0.449825,11852.0,A 45 años del golpe cívico-militar&#x2c; UNCiencia explora cómo diversos libros&#x2c; tanto en Argentina como en Chile&#x2c; recogen&#x2c; recrean y retransmiten las memorias recibidas de quienes vivieron esos acontecimientos. Laura Fandiño&#x2c; investigadora de la UNC&#x2c; propone un recorrido por estas renovadas lecturas del pasado que articulan la violencia política&#x2c; la memoria y la literatura del Cono Sur. Advierte que los textos no se agotan en la perspectiva de las víctimas directas (hijos e hijas de personas desaparecidas)&#x2c; sino que se amplía a descendientes de colaboracionistas&#x2c; de represores y de familias sin vínculo directo con el régimen&#x2c; lo que evidencia el impacto directo del pasado traumático y sus efectos tentaculares en las tramas colectivas&#x2c; familiares y subjetivas. [23.03.2021],,,,,,,,,
t-249,Estudio ayudaría a explicar el alto riesgo de las personas con síndrome de Down a padecer enfermedades autoinmunes,https://unciencia.unc.edu.ar/salud/estudio-ayudaria-a-explicar-el-alto-riesgo-de-las-personas-con-sindrome-de-down-a-padecer-enfermedades-autoinmunes/,https://unciencia.unc.edu.ar/wp-content/blogs.dir/31/files/sites/4/2021/03/UNCiencia_Sist-Inmune-Sindrome-de-Down-01-1920-1024x503.jpg,Artículos,Salud,2021,0.278503,7338.0,Un trabajo del Centro de Investigaciones en Bioquímica Clínica e Inmunología de la UNC y Conicet demostró que las personas con síndrome de Down&#x2c; aunque estén sanas&#x2c; tienen un sistema inmune hiperreactivo&#x2c; es decir&#x2c; que trabaja todo el tiempo como si estuviera combatiendo una infección viral. Esto explicaría por qué mientras están más protegidas que el resto de la población contra la mayoría de los tumores sólidos&#x2c; tienen una mayor incidencia de enfermedades autoinmunes. El 21 de marzo es el Día Mundial del Síndrome de Down. [17.03.2020],,,,,,,,,
t-250,"La solidaridad, una herramienta clave frente a la pandemia en Córdoba",https://unciencia.unc.edu.ar/sociedad/la-solidaridad-una-herramienta-clave-frente-a-la-pandemia-en-cordoba/,https://unciencia.unc.edu.ar/wp-content/blogs.dir/31/files/sites/4/2021/03/UNCiencia-Cartografia-de-la-Solidaridad-01-1920-1024x503.jpg,Artículos,Sociedad,2021,0.469106,12360.0,Un grupo de investigación de la Facultad de Ciencias Sociales de la UNC elaboró una “Cartografía de la Solidaridad”. Es un relevamiento de las acciones llevadas adelante en toda la provincia de Córdoba por casi 40 organizaciones sociales&#x2c; que asisten y acompañan a más de 6.000 personas. Destacan el rol de estas entidades en la gestión de la crisis&#x2c; en el acatamiento de las medidas de aislamiento&#x2c; y en la generación de respuestas a las necesidades de las poblaciones que sufren carencias estructurales. Advierten sobre la necesidad de reforzar la presencia estatal en territorios de vulnerabilidad social. [10.03.2021],,,,,,,,,
t-251,Fútbol y ciencia: identifican el patrón de posesión de la pelota,https://unciencia.unc.edu.ar/computacion/futbol-y-ciencia-identifican-el-patron-de-posesion-de-la-pelota/,https://unciencia.unc.edu.ar/wp-content/blogs.dir/31/files/sites/4/2021/03/UNCiencia_fisicos-del-futbol-01-1920-1024x503.jpg,Artículos,Computación,2021,0.228442,6019.0,Aplicando herramientas de la física estadística&#x2c; una investigación del Instituto de Física Enrique Gaviola ( UNC-Conicet) analizó datos de 1.826 partidos jugados en las cinco ligas de fútbol más importantes de Europa. El trabajo permitió reconocer la dinámica que sigue la posesión del balón. Este tipo de análisis y modelado de datos deportivos despierta mucho interés&#x2c; ya que puede emplearse&#x2c; por ejemplo&#x2c; para estimar la demanda física de los jugadores durante un encuentro o diagramar entrenamientos en espacios reducidos&#x2c; que luego tienen gran impacto al momento de la competencia. Tres empresas ya se contactaron con los autores del estudio. [03.03.2021],,,,,,,,,
t-252,"En nueve años, casi se triplicó el número de viviendas con mosquitos transmisores del dengue",https://unciencia.unc.edu.ar/biologia/en-nueve-anos-casi-se-triplico-el-numero-de-viviendas-con-mosquitos-transmisores-del-dengue/,https://unciencia.unc.edu.ar/wp-content/blogs.dir/31/files/sites/4/2021/02/UNCiencia_aedes_aegypti-02-1920-1024x503.jpg,Artículos,Biología,2021,0.187491,4940.0,Mientras que en 2009 se hallaron larvas en el 5&#x2c;7% de las casas relevadas en la ciudad de Córdoba&#x2c; para 2017 ese porcentaje había subido hasta el 15&#x2c;4%&#x2c; de acuerdo a un estudio publicado meses atrás. Para que el riesgo de contagio sea bajo&#x2c; la Organización Mundial de la Salud aconseja que ese valor no supere el 1%. Aedes aegypti es el principal vector portador de los virus que provocan dengue&#x2c; zika y la fiebre chikungunya. Febrero y marzo son los meses de mayor transmisión&#x2c; recuerdan especialistas y marcan la importancia de evitar criaderos como medida de prevención. [24.02.2021],,,,,,,,,
t-253,Detectan ADN de la bacteria del cólera en restos humanos inhumados en una fosa común del siglo XIX en Córdoba,https://unciencia.unc.edu.ar/antropologia/detectan-adn-de-la-bacteria-del-colera-en-restos-humanos-inhumados-en-una-fosa-comun-en-cordoba-en-el-siglo-xix/,https://unciencia.unc.edu.ar/wp-content/blogs.dir/31/files/sites/4/2021/02/detectan_adn1-1024x503.jpg,Artículos,Antropología,2021,0.342379,9021.0,Por la cercanía con el ex Centro Clandestino «Campo de la Ribera»&#x2c; inicialmente se pensó que los restos humanos podían tratarse de víctimas de la última dictadura cívico-militar. Pero dado que el material óseo hallado tenía más de 100 años&#x2c; el Equipo Argentino de Antropología Forense (EAAF) descartó esa posibilidad. La novedad es que un grupo interdisciplinario de científicos de la UNC logró confirmar que ese enterramiento –descubierto en 2011 y denominado “La Zanja”– estuvo destinado a los fallecidos por la quinta pandemia de cólera&#x2c; que azotó a Argentina entre 1886 y1887. En Córdoba&#x2c; esa enfermedad cobró la vida de más de mil personas. El descubrimiento fue publicado recientemente en la revista International Journal of Paleopathology. [17.02.2021],,,,,,,,,
t-254,Las mujeres realizan más del 85% del trabajo comunitario,https://unciencia.unc.edu.ar/sociedad/las-mujeres-realizan-mas-del-85-del-trabajo-comunitario/,https://unciencia.unc.edu.ar/wp-content/blogs.dir/31/files/sites/4/2022/12/UNCiencia-mujeres-y-trabajo-comunitario-01-1920-1024x503.jpg,Artículos,Sociedad,2022,0.447852,11800.0,Los cuidados como un derecho humano | Comedores&#x2c; merenderos y otros espacios comunitarios son sostenidos mayoritariamente por mujeres&#x2c; quienes dedican a este trabajo entre 5&#x2c;5 y 7 horas diarias&#x2c; sin recibir un salario a cambio. El dato surge de un informe técnico realizado recientemente por la Facultad de Ciencias Sociales de la UNC que abarcó 51 espacios sociocomunitarios de la ciudad de Córdoba&#x2c; y da cuenta del enorme valor social de esta tarea para la sostenibilidad de la vida en los barrios donde funcionan. El reconocimiento de los cuidados como un derecho humano fue planteado durante la última conferencia regional de la ONU realizada en noviembre en Argentina. [15.12.2022],,,,,,,,,
t-255,Proponen declarar patrimonio de la provincia a los guanacos de Córdoba,https://unciencia.unc.edu.ar/antropologia/proponen-declarar-patrimonio-de-la-provincia-a-los-guanacos-de-cordoba/,https://unciencia.unc.edu.ar/wp-content/blogs.dir/31/files/sites/4/2022/12/UNCiencia-Guanacos-Patrimonio-de-la-Humanidad-01-1920-1024x503.jpg,Artículos,Antropología,2022,0.446713,11770.0,La propuesta surge de una investigación del Instituto de Antropología de Córdoba (Conicet) – Museo de Antropologías (UNC) que indagó sobre las interacciones históricas entre seres humanos y esos camélidos. El estudio integró los relatos y percepciones de quienes habitan en zonas rurales con el análisis de los restos óseos de estos animales&#x2c; producidos en su mayoría por actividades de caza ilegal. Los guanacos se encuentran en riesgo de extinción en la región. El equipo científico considera necesario&#x2c; además&#x2c; que la caza de subsistencia practicada por habitantes de la zona sea contemplada como parte del patrimonio inmaterial local. [12.12.2022],,,,,,,,,
t-256,Descubren que una molécula puede funcionar como biomarcador de cáncer: los caminos que se abren a partir del hallazgo,https://unciencia.unc.edu.ar/salud/descubren-que-una-molecula-puede-funcionar-como-biomarcador-de-cancer-los-caminos-que-se-abren-a-partir-del-hallazgo/,https://unciencia.unc.edu.ar/wp-content/blogs.dir/31/files/sites/4/2022/12/UNCiencia-equipo-de-investigacion-Cancer-de-Mama-01-1920-1024x503.jpg,Artículos,Salud,2022,0.231555,6101.0,El avance fue realizado por un equipo de la Facultad de Ciencias Químicas y publicado poco antes del inicio de la pandemia en Cancer Research&#x2c; una revista científica de prestigio internacional. La molécula&#x2c; denominada ectoenzima (CD39)&#x2c; permitiría incluso advertir si los pacientes tratados con inmunoterapia responden correctamente o no al tratamiento. Estudios realizados por equipos de investigación de otros países ya confirmaron que esto también aplica para cáncer de colon&#x2c; renal y otros. [07.12.2022],,,,,,,,,
t-257,Noche de los Museos 2022 | Una constelación de datos,https://unciencia.unc.edu.ar/especial/noche-de-los-museos-2022-una-constelacion-de-datos/,https://unciencia.unc.edu.ar/wp-content/blogs.dir/31/files/sites/4/2022/11/2022-UNCIENCIA-ESPECIAL-NM-1920x944-1-1024x503.png,Artículos,Producción especial,2022,0.072415,1908.0,"¿Sabés cuál es el museo más antiguo de la Universidad Nacional de Córdoba? ¿O cuál atesora la mayor cantidad de objetos y colecciones? ¿Y el que tiene mayor espacio para recorrer? Esta visualización arroja luz sobre esos interrogantes. Para cada museo y espacio cultural que participó en la edición 2022 de la ""Noche de los Museos""&#x2c; las respuestas a esas preguntas se representan gráficamente con círculos: su tamaño y ubicación respecto al centro de la constelación obedecen a la información de cada uno de ellos. El color&#x2c; sin embargo&#x2c; es aleatorio y cambia cada vez que actualizás el navegador.",,,,,,,,,
t-258,Especialistas elaboran una cartilla de germinación para optimizar la producción de plantas nativas,https://unciencia.unc.edu.ar/biologia/especialistas-elaboran-una-cartilla-de-germinacion-para-optimizar-la-produccion-de-plantas-nativas/,https://unciencia.unc.edu.ar/wp-content/blogs.dir/31/files/sites/4/2022/11/UNCiencia-guia-de-plantas-nativas-01-1920.jpg,Artículos,Biología,2022,0.337521,8893.0,Contiene información novedosa y práctica sobre cómo producir la mayor cantidad de plantas nativas en el menor tiempo posible&#x2c; con fines de restauración y recuperación de ecosistemas autóctonos dañados por incendios o pérdida de la cobertura vegetal. Fue elaborada por un equipo del Imbiv&#x2c; e incluye un protocolo con indicaciones acerca de las mejores condiciones de temperatura&#x2c; luz y almacenamiento para la germinación de especies nativas. Hasta ahora&#x2c; sólo había información fragmentada e incompleta sobre el tema. [03.11.2022],,,,,,,,,
t-259,Estudiantes de la UNC crearon un dispositivo que facilita el entrenamiento de natación para personas ciegas,https://unciencia.unc.edu.ar/innovacion/estudiantes-de-la-unc-crearon-un-dispositivo-que-facilita-el-entrenamiento-de-natacion-para-personas-ciegas/,https://unciencia.unc.edu.ar/wp-content/blogs.dir/31/files/sites/4/2022/10/UNCiencia_gorra-de-natacion-para-ciegos-02-1920.jpg,Artículos,Innovación,2022,0.247116,6511.0,El sistema genera una vibración en el gorro para alertar de la cercanía del final de la pileta. Hasta ahora&#x2c; otra persona debía avisarles mediante un toque o “tap” en sus cabezas&#x2c; por lo que la innovación les brinda mayor autonomía a la hora de las prácticas. El invento fue distinguido en la última edición del concurso Innovar&#x2c; del Ministerio de Ciencia de la Nación. De la instancia final de ese certamen participaron otros tres desarrollos de la UNC. [31.10.2022],,,,,,,,,
t-260,Confirman que es seguro consumir yerba mate durante la lactancia materna,https://unciencia.unc.edu.ar/salud/confirman-que-es-seguro-consumir-yerba-mate-durante-la-lactancia-materna/,https://unciencia.unc.edu.ar/wp-content/blogs.dir/31/files/sites/4/2022/10/UNCiencia-yerba-mate-y-maternidad-01-1920-1024x503.jpg,Artículos,Salud,2022,0.208061,5482.0,Existen diversos mitos sobre las ventajas y contraindicaciones de tomar mate cocido o cebado durante la lactancia. Un equipo de la Facultad de Ciencias Médicas de la UNC demostró que los riesgos no son reales. Por el contrario&#x2c; el trabajo aporta evidencia científica sobre los beneficios de incorporar esas infusiones en la dieta cotidiana&#x2c; ya que aporta polifenoles y antioxidantes que mejoran la calidad de la leche materna. [26.10.2022],,,,,,,,,
t-261,"Hemoderivados, más cerca de comenzar a producir el líquido conservador de órganos para trasplantes",https://unciencia.unc.edu.ar/salud/hemoderivados-mas-cerca-de-comenzar-a-producir-el-liquido-conservador-de-organos-para-trasplantes/,https://unciencia.unc.edu.ar/wp-content/blogs.dir/31/files/sites/4/2022/10/UNCiencia-Liquido-Conservador-de-organos-01-1920-1024x503.jpg,Artículos,Salud,2022,0.327008,8616.0,En las próximas semanas&#x2c; el laboratorio universitario lanzará la licitación para refuncionalizar la planta donde se elaborará la formulación. Hasta ahora&#x2c; ese insumo médico debe ser importado. Su desarrollo fue solicitado por el Incucai y demandó años de investigación y desarrollo. Según proyecciones de Hemoderivados&#x2c; tres meses de producción alcanzarán para cubrir la demanda anual nacional (seis mil litros)&#x2c; y sus equipos técnicos ya relevan los requisitos para registrar el producto en otros países de América del Sur. A nivel mundial&#x2c; se prevé que el mercado de este tipo de soluciones alcanzará los 317 millones de dólares para 2026. [13.10.2022],,,,,,,,,
t-262,Investigan el uso de la realidad virtual como herramienta terapéutica para aliviar el dolor agudo,https://unciencia.unc.edu.ar/psicologia/investigan-el-uso-de-la-realidad-virtual-como-herramienta-terapeutica-para-aliviar-el-dolor-agudo/,https://unciencia.unc.edu.ar/wp-content/blogs.dir/31/files/sites/4/2022/09/UNCiencia_realidad_virtual-en-terapias-alternativas-01-1920-1024x503.jpg,Artículos,Psicología,2022,0.311712,8213.0,Un trabajo del Laboratorio de Psicología Experimental de la UNC es pionero en estudiar los beneficios de la inmersión de pacientes en entornos virtuales con una narrativa terapéutica para mejorar la gestión del dolor. Experimentos realizados en laboratorio permitieron comprobar que la combinación de esta tecnología con ejercicios de respiración y meditación incrementó un 85% la tolerancia al dolor entre quienes participaron en las pruebas de criopresión (mantener la mano en agua helada). La narrativa terapéutica ayuda a la persona a focalizar su atención por fuera de las zonas del cuerpo donde se concentra el proceso del dolor. Diversas publicaciones señalan que el uso de la realidad virtual ayuda a reducir el uso de analgésicos.  [29.09.2022],,,,,,,,,
t-263,Investigadoras de la UNC desarrollan un sistema capaz de erradicar una bacteria sumamente resistente a antibióticos,https://unciencia.unc.edu.ar/salud/investigadoras-de-la-unc-desarrollan-un-sistema-capaz-de-erradicar-una-bacteria-sumamente-resistente-a-antibioticos/,https://unciencia.unc.edu.ar/wp-content/blogs.dir/31/files/sites/4/2022/09/UNCiencia-Resist-Bact-02-1920-1024x503.jpg,Artículos,Salud,2022,0.312699,8239.0,Resistencia antimicrobiana | Se trata de Pseudomonas aeruginosa&#x2c; sobre la cual la Organización Mundial de la Salud ha advertido la necesidad crítica de desarrollar nuevos medicamentos. Investigadoras de la UNC y el Conicet lograron erradicar esta bacteria en el laboratorio ideando un sistema que transporta un antibiótico de acción reducida. El estudio contribuye a combatir la resistencia antimicrobiana&#x2c; considerada un problema de salud pública a nivel mundial&#x2c; sobre el que Argentina acaba de sancionar una ley regulatoria. [14.09.2022],,,,,,,,,
t-264,Los dientes y prótesis bucales en mal estado potencian el riesgo de cáncer en pacientes que fuman y toman alcohol,https://unciencia.unc.edu.ar/odontologia/los-dientes-y-protesis-bucales-en-mal-estado-potencian-el-riesgo-de-cancer-en-pacientes-que-fuman-y-toman-alcohol/,https://unciencia.unc.edu.ar/wp-content/blogs.dir/31/files/sites/4/2022/08/UNCiencia-Probabilidades-de-cancer-bucal-por-uso-de-protesis-01-1920-1024x503.jpg,Artículos,Odontología,2022,0.309625,8158.0,Así lo determinó una investigación de la Facultad de Odontología de la UNC que analizó datos recabados durante una década. La conclusión cubre un vacío en la bibliografía en este campo de la salud y por ello la demostración empírica aportada por el equipo de la cátedra de Estomatología adquiere una relevancia inusitada. Hasta el presente se sabía que la ingesta de alcohol y tabaco favorecían el desarrollo de cáncer bucal&#x2c; pero nunca se había probado que la irritación mecánica crónica potenciara la acción de esos factores a tal punto que&#x2c; en determinados casos&#x2c; el riesgo se duplica. Para colaborar en el estudio&#x2c; al grupo científico local se sumó el director del Departamento de Cáncer Bucal de la Organización Mundial de la Salud. La Facultad de Odontología de la UNC ofrece consultas y diagnósticos gratuitos. [18.08.2022],,,,,,,,,
