uid,title,url,image,contenttype,serie,year,normalized,characters,firstparagraph,allpixels,paperpixels,paintedpixels,description,country,duration,seconds,mp3,interviews
a-007,Posthumanismo y la relación cuerpos-tecnologías a través del arte,https://unciencia.unc.edu.ar/podcasts/posthumanismo-y-la-relacion-cuerpos-tecnologias-a-traves-del-arte/,https://unciencia.unc.edu.ar/wp-content/blogs.dir/31/files/sites/4/2021/12/05-poshumanismo-y-tecnologias-encabezado-1024x277.jpg,Producción audiovisual,Podcast,2021,0.165115,,,,,,"Los vínculos entre tecnología&#x2c; cuerpo, arte y formas de vida son el tema de investigación de un grupo interdisciplinario de la UNC que lleva adelante un trabajo titulado “La condición posthumana: ¿qué hacemos con las tecnologías y qué nos hacen las tecnologías?",,00:12:07,727,https://unciencia.unc.edu.ar/wp-content/blogs.dir/31/files/sites/4/2021/12/unciencia-podcast-posthumanismo.mp3,Dialogamos con Alicia Vaggione y Andrea Torrano - Facultad de Ciencias Sociales de la UNC
a-008,Discursos de odio: por qué crecen en el mundo,https://unciencia.unc.edu.ar/podcasts/discursos-de-odio-por-que-crecen-en-el-mundo/,https://unciencia.unc.edu.ar/wp-content/blogs.dir/31/files/sites/4/2021/12/04-Discursos-de-odio-encabezado-1024x277.jpg,Producción audiovisual,Podcast,2021,0.247104,,,,,,"A diario leemos y escuchamos frases que toman al odio como argumento. No solo sucede en Argentina&#x2c; sino que se trata de un fenómeno global. ¿Están resurgiendo ideas y valores que creíamos superados? ¿Estamos frente a un momento histórico, en el que el odio es una herramienta política?",,00:18:08,1088,https://unciencia.unc.edu.ar/wp-content/blogs.dir/31/files/sites/4/2021/12/unciencia-.podcast-discursos-de-odio.mp3,Dialogamos con Diego Tachella - Docente de la UNC
a-009,El aire de Córdoba,https://unciencia.unc.edu.ar/podcasts/el-aire-de-cordoba/,https://unciencia.unc.edu.ar/wp-content/blogs.dir/31/files/sites/4/2021/11/29-aire-en-Cordoba-encabezado-1024x277.jpg,Producción audiovisual,Podcast,2021,0.168067,,,,,,Un equipo de investigación de la UNC midió la calidad del aire de Córdoba a través de sensores instalados en diez sitios de muestreo.,,00:12:20,740,https://unciencia.unc.edu.ar/wp-content/blogs.dir/31/files/sites/4/2021/11/unciencia-podcast-calidad-del-aire-en-cordoba.mp3,Dialogamos con Hebe Carreras - Profesora en Ciencias Biológicas de la UNC
a-010,Hacia la transición energética,https://unciencia.unc.edu.ar/podcasts/hacia-la-transicion-energetica/,https://unciencia.unc.edu.ar/wp-content/blogs.dir/31/files/sites/4/2021/11/03-hidrogeno-verde-encabezado-1024x277.jpg,Producción audiovisual,Podcast,2021,0.174427,,,,,,"Días pasados&#x2c; en la Cumbre de las Naciones Unidas sobre el Cambio Climático, el gobierno nacional confirmó la intención de convertir a Argentina en un polo mundial productor y exportador de hidrógeno verde. ¿Qué es, para qué sirve y cómo se produce?",,00:12:48,768,https://unciencia.unc.edu.ar/wp-content/blogs.dir/31/files/sites/4/2021/11/unciencia-podcast-hidrogeno-verde.mp3,"Dialogamos con Agustín Sigal - Profesor ayudante de la Facultad de Matemática&#x2c; Astronomía, Física y Computación, y de la Facultad de Ciencias Químicas. Investigador Asistente del Conicet"
a-011,Ley de etiquetado frontal para hacerle frente a la mala alimentación,https://unciencia.unc.edu.ar/podcasts/ley-de-etiquetado-frontal-para-hacerle-frente-a-la-mala-alimentacion/,https://unciencia.unc.edu.ar/wp-content/blogs.dir/31/files/sites/4/2021/11/02-Etiquetado-Frontal-01-encabezado-1024x277.jpg,Producción audiovisual,Podcast,2021,0.079945,,,,,,"Finalmente se aprobó en Argentina la ley de etiquetado frontal de alimentos&#x2c; una iniciativa que busca ayudar a combatir la obesidad, la hipertensión y los riesgos cardíacos. En este episodio, las obligaciones del Estado   y las empresas que se desprenden de la nueva legislación.",,00:05:52,352,https://unciencia.unc.edu.ar/wp-content/blogs.dir/31/files/sites/4/2021/11/unciencia-podcast-ley-etiquetado-frontal-de-alimentos.mp3,Dialogamos con Agustina Mozzoni - Integrante del Grupo de Investigación en Derechos Sociales (Gides)&#x2c; del Centro de Investigaciones Jurídicas y Sociales de la UNC
a-012,150 años mirando el cielo,https://unciencia.unc.edu.ar/podcasts/150-anios-mirando-el-cielo/,https://unciencia.unc.edu.ar/wp-content/blogs.dir/31/files/sites/4/2021/10/28-Aniversario-OAC-encabezado-1024x277.jpg,Producción audiovisual,Podcast,2021,0.082217,,,,,,"El Observatorio Astronómico de Córdoba (OAC)&#x2c; fundado en 1871, está conmemorando los 150 años de su creación.",,00:06:02,362,https://unciencia.unc.edu.ar/wp-content/blogs.dir/31/files/sites/4/2021/10/unciencia-podcast-150-aniversario-observatorio-astronomico.mp3,Dialogamos con Santiago Paolantonio - Especialista en historia de la astronomía
a-013,Sitios de Memoria en Argentina: usos y proyecciones,https://unciencia.unc.edu.ar/podcasts/sitios-de-memoria-en-argentina-usos-y-proyecciones/,https://unciencia.unc.edu.ar/wp-content/blogs.dir/31/files/sites/4/2021/10/01-ESMA-patrimonio-de-la-humanidad-encabezado-1024x277.jpg,Producción audiovisual,Podcast,2021,0.119691,,,,,,"El Museo Sitio de Memoria ESMA&#x2c; ex centro clandestino de detención, tortura y exterminio de la última dictadura militar, fue presentado para que integre la lista de Patrimonio Mundial de Unesco.",,00:08:47,527,https://unciencia.unc.edu.ar/wp-content/blogs.dir/31/files/sites/4/2021/10/unciencia-podcast-sitios-de-memoria-unesco.mp3,Dialogamos con Mariana Tello - Antropóloga&#x2c; Universidad Nacional de Córdoba
a-014,"El Siasge, un hito de la ciencia argentina",https://unciencia.unc.edu.ar/podcasts/el-siasge-un-hito-de-la-ciencia-argentina/,https://unciencia.unc.edu.ar/wp-content/blogs.dir/31/files/sites/4/2021/10/26-SIASGE-encabezado-1024x277.jpg,Producción audiovisual,Podcast,2021,0.14422,,,,,,"Hace poco más de un año&#x2c; fue lanzado el satélite argentino de observación de la Tierra, Saocom 1B, de la Comisión Nacional de Actividades Espaciales (Conae). La puesta en órbita de este satélite completa la constelación Saocom, que representa la misión espacial más ambiciosa de Argentina. ",,00:10:35,635,https://unciencia.unc.edu.ar/wp-content/blogs.dir/31/files/sites/4/2021/10/unciencia-podcast-siasge.mp3,
a-015,Caminata de pueblos indígenas contra la violencia,https://unciencia.unc.edu.ar/podcasts/caminata-de-pueblos-indigenas-contra-la-violencia/,https://unciencia.unc.edu.ar/wp-content/blogs.dir/31/files/sites/4/2021/09/25-Caminata-Pueblos-Originarios-encabezado-1024x277.jpg,Producción audiovisual,Podcast,2021,0.100159,,,,,,Comunidades indígenas de Córdoba realizaron una caminata para visibilizar las amenazas y los hechos de violencia que están padeciendo. Denunciaron el avance de la violencia por parte de grupos de negocios inmobiliarios&#x2c; canteras&#x2c; autovías y la repetición de los incendios sobre los territorios ancestrales.,,00:07:21,441,https://unciencia.unc.edu.ar/wp-content/blogs.dir/31/files/sites/4/2021/09/unciencia-podcast-caminata-comunidades-indigenas.mp3,Dialogamos con José María Bompadre - Antropólogo&#x2c; profesor de las facultades de Ciencias de la Comunicación&#x2c; y de Filosofía y Humanidades de la UNC
a-016,Criptomonedas: detrás de la pseudo democratización del dinero,https://unciencia.unc.edu.ar/podcasts/criptomonedas-detras-del-relato-de-la-democratizacion-del-dinero/,https://unciencia.unc.edu.ar/wp-content/blogs.dir/31/files/sites/4/2021/09/24-criptomonedas-03-encabezado-1024x277.jpg,Producción audiovisual,Podcast,2021,0.134227,,,,,,Un artículo publicado en 2009 y firmado con el seudónimo «Satoshi Nakamoto» declaró las bases de funcionamiento de bitcoin como una herramienta para prescindir de intermediarios como el Estado o los bancos. Sin embargo&#x2c; la ilusión del poder económico en manos de las personas parece haberse esfumado y  las criptomonedas  se transformaron en activos que fomentan la especulación financiera.,,00:09:51,591,https://unciencia.unc.edu.ar/wp-content/blogs.dir/31/files/sites/4/2021/09/unciencia-podcast-criptomonedas.mp3,Dialogamos con Mariana Gutiérrez - Becaria doctoral en el Instituto de Estudios en Comunicación&#x2c; Expresión y Tecnologías (Facultad de Ciencias de la Comunicación – UNC/Conicet)
a-017,Geopolítica y vacunas,https://unciencia.unc.edu.ar/podcasts/geopolitica-y-vacunas/,https://unciencia.unc.edu.ar/wp-content/blogs.dir/31/files/sites/4/2021/09/23-vacunas-y-geopolitica-encabezado02-1024x277.jpg,Producción audiovisual,Podcast,2021,0.290938,,,,,,"El mercado mundial de las vacunas contra COVID-19 puso en evidencia la deriva de la globalización neoliberal. La producción&#x2c; la distribución y el costo de las vacunas están regidos por la lógica mercantil, privatista y competitiva con la cual se construyó la globalización neoliberal.",,00:21:21,1281,https://unciencia.unc.edu.ar/wp-content/blogs.dir/31/files/sites/4/2021/09/unciencia-podcast-mercado-vacunas.mp3,Dialogamos con María Teresa Piñero - Centro de Estudios Avanzados – Facultad de Ciencias Sociales de la UNC
a-018,Astrónomo de la UNC en el podio,https://unciencia.unc.edu.ar/podcasts/astronomo-de-la-unc-en-el-podio/,https://unciencia.unc.edu.ar/wp-content/blogs.dir/31/files/sites/4/2021/09/22-OAC-premio-Astronomo-Correa-01-1024x277.jpg,Producción audiovisual,Podcast,2021,0.173745,,,,,,"El astrónomo salteño Carlos Correa&#x2c; investigador en la UNC, fue galardonado recientemente con el premio a la mejor tesis en el área de gravitación clásica otorgado por el Centro Internacional de Física Teórica (ICTP) de San Pablo, Brasil. ¿Qué es la cosmología? ¿Qué son los vacíos cósmicos y qué es la energía oscura?",,00:12:45,765,https://unciencia.unc.edu.ar/wp-content/blogs.dir/31/files/sites/4/2021/09/unciencia-podcast-cosmologia.mp3,Dialogamos con Carlos Correa - Doctor en Astronomía e investigador de la UNC
a-019,Migrantes en Argentina: acceso a derechos e impacto de la pandemia,https://unciencia.unc.edu.ar/podcasts/migrantes-en-argentina-acceso-a-derechos-e-impacto-de-la-pandemia/,https://unciencia.unc.edu.ar/wp-content/blogs.dir/31/files/sites/4/2021/08/21-migrantes-01c-encabezado-1024x277.jpg,Producción audiovisual,Podcast,2021,0.137861,,,,,,La Encuesta Nacional Migrante realizada en 2020 relevó cuestiones relacionadas al acceso a derechos de la población migrante. También analizó el impacto que tuvieron en ella las medidas dispuestas por la pandemia de COVID-19. Los datos revelan que solo un 35% tiene trabajo en relación de dependencia.  ,,00:10:07,607,https://unciencia.unc.edu.ar/wp-content/blogs.dir/31/files/sites/4/2021/08/unciencia-podcast-migrantes-en-argentina.mp3,Dialogamos con Eduardo Rodríguez Rocha - Centro de Investigaciones y Estudios sobre Cultura y Sociedad (Ciecs – UNC/Conicet)
a-020,Negacionismo y neoliberalismo,https://unciencia.unc.edu.ar/podcasts/negacionismo-y-neoliberalismo/,https://unciencia.unc.edu.ar/wp-content/blogs.dir/31/files/sites/4/2021/08/20-Negacionismo-encabezado-1024x277.jpg,Producción audiovisual,Podcast,2021,0.195321,,,,,,"El negacionismo es una manifestación social de época generada por el neoliberalismo y acentuada por la pandemia. Los antivacunas son solo una parte de un conjunto mayor que forman&#x2c; entre otros, los terraplanistas, los negadores del cambio climático, los conspiracionistas y, en Argentina, quienes niegan las atrocidades cometidas por la última dictadura cívico-militar.  ",,00:14:20,860,https://unciencia.unc.edu.ar/wp-content/blogs.dir/31/files/sites/4/2021/08/unciencia-podcast-negacionismo-y-neoliberalismo.mp3,Dialogamos con Jorge Foa Torres [Doctor en Ciencia Política (CEA/UNC). Investigador adjunto del Conicet&#x2c; codirector del programa Construcciones neoliberales (CEA/UNC)] y Juan Reynares [Doctor en Ciencia Política (CEA/UNC). Investigador adjunto del Conicet]
a-021,Educación para adultos: cómo hacer para seguir,https://unciencia.unc.edu.ar/podcasts/educacion-para-adultos-como-hacer-para-seguir/,https://unciencia.unc.edu.ar/wp-content/blogs.dir/31/files/sites/4/2021/08/19-educacion-en-adultos-encabezado-1024x277.jpg,Producción audiovisual,Podcast,2021,0.097206,,,,,,La escuela es hoy una de las preocupaciones centrales para los estados y la ciudadanía. Sin embargo&#x2c; hay un nivel del que se habla poco: el de las personas adultas. El área de educación primaria es una de las que más sufrió los efectos de la pandemia.  ,,00:07:08,428,https://unciencia.unc.edu.ar/wp-content/blogs.dir/31/files/sites/4/2021/08/unciencia-podcast-educacion-adultos.mp3,"Dialogamos con María del Carmen Lorenzatti, docente e investigadora de la Facultad de Filosofía y Humanidades de la UNC"
a-022,Un libro para pensar cómo se reparte el poder,https://unciencia.unc.edu.ar/podcasts/un-libro-para-pensar-como-se-reparte-el-poder/,https://unciencia.unc.edu.ar/wp-content/blogs.dir/31/files/sites/4/2021/07/18-Descentralizacion-y-democracia-Modelo-para-armar-01-1024x277.jpg,Producción audiovisual,Podcast,2021,0.131728,,,,,,"La descentralización del poder es un desafío de las democracias contemporáneas y es el tema de la publicación ""Modelos para armar: Procesos federales actuales&#x2c; descentralización del poder y desafíos del gobierno multinivel"". El libro fue recientemente editado por la UNC y reúne el estudio de diecisiete casos de países cuya organización estatal transita bajo principios federativos. ",,00:09:40,580,https://unciencia.unc.edu.ar/wp-content/blogs.dir/31/files/sites/4/2021/07/unciencia-podcast-descentralizacion-del-poder.mp3,Dialogamos con Marcelo Bernal - Abogado y uno de los autores del libro
a-023,Los primeros cordobeses,https://unciencia.unc.edu.ar/podcasts/los-primeros-cordobeses/,https://unciencia.unc.edu.ar/wp-content/blogs.dir/31/files/sites/4/2021/07/17-ADN-cordob%C3%A9s-encabezado-1920x400-c-default.jpg,Producción audiovisual,Podcast,2021,0.149671,,,,,,"A partir del estudio del ADN de más de mil habitantes actuales de Córdoba&#x2c; una investigación determinó que aproximadamente el 70% de los cordobeses tienen origen materno nativo americano o indígena, el 23% origen europeo y el 7% posee linajes africanos. En el caso del linaje paterno&#x2c; el 95% de las personas tiene origen europeo.",,00:10:59,659,https://unciencia.unc.edu.ar/wp-content/blogs.dir/31/files/sites/4/2021/07/unciencia-podcast-los-primeros-cordobeses.mp3," Dialogamos con Angelina García y  Rodrigo Nores, ambos profesores de la Facultad de Filosofía y Humanidades (UNC) e investigadores del Instituto de Antropología de Córdoba (UNC/Conicet)"
a-024,Cannabis medicinal: una cura que ya es ley,https://unciencia.unc.edu.ar/podcasts/cannabis-medicinal-una-cura-que-ya-es-ley/,https://unciencia.unc.edu.ar/wp-content/blogs.dir/31/files/sites/4/2021/07/16-Cannabis-medicinal-encabezado-1024x277.jpg,Producción audiovisual,Podcast,2021,0.204406,,,,,,Córdoba adhirió a la ley nacional para el uso medicinal del cannabis. Para los pacientes que lo necesitan para usos curativos&#x2c; la decisión significa la tranquilidad de no ser perseguidos penalmente y también de poder conocer mejor la calidad del producto que consumen y sus costos. ¿Cómo se aplica esta ley y cuál es el rol de las universidades en ese marco? ,,00:15:00,900,https://unciencia.unc.edu.ar/wp-content/blogs.dir/31/files/sites/4/2021/07/unciencia-podcast-cannabis-medicinal.mp3,Dialogamos con Federico Racca - Docente de la cátedra de Farmacología Aplicada de la UNC
a-025,El derecho a conocer el cielo,https://unciencia.unc.edu.ar/podcasts/el-derecho-a-conocer-el-cielo/,https://unciencia.unc.edu.ar/wp-content/blogs.dir/31/files/sites/4/2021/07/15-Derecho-al-Cielo-encabezado-1024x277.jpg,Producción audiovisual,Podcast,2021,0.125142,,,,,,Derecho al Cielo es un proyecto de enseñanza y aprendizaje de astronomía que lleva a cabo un grupo interdisciplinario de la UNC junto a jóvenes en contexto de encierro punitivo. Talleristas y participantes cuentan cómo es esta experiencia que se desarrolla en el Complejo Esperanza y en el Centro Socioeducativo para Adolescentes Mujeres&#x2c; de la ciudad de Córdoba. ,,00:09:11,551,https://unciencia.unc.edu.ar/wp-content/blogs.dir/31/files/sites/4/2021/07/unciencia-podcast-derecho-al-cielo.mp3,
a-026,Una economía con capital social,https://unciencia.unc.edu.ar/podcasts/una-economia-con-capital-social/,https://unciencia.unc.edu.ar/wp-content/blogs.dir/31/files/sites/4/2021/06/14-Economia-social-y-popular-01-1024x277.jpg,Producción audiovisual,Podcast,2021,0.254372,,,,,,"La economía popular engloba un conjunto de prácticas  desarrolladas como una forma de resistencia al sistema capitalista o como manera de supervivencia&#x2c; ante un mundo del trabajo caracterizado por la fragmentación, la informalidad y precarización laboral. Generalmente practicada por los sectores populares&#x2c; hace posible el desarrollo de una economía que no solo intercambia mercancías, sino que también genera y consolida lazos sociales.  ",,00:18:40,1120,https://unciencia.unc.edu.ar/wp-content/blogs.dir/31/files/sites/4/2021/06/unciencia-podcast-economia-solidaria.mp3,"Dialogamos con Karina Tomatis - Docente e investigadora. Coordinadora del programa de Extensión  «Economías&#x2c; trabajo y prácticas asociativas«, de la Facultad de Ciencias Sociales (UNC)"
a-027,Entender la salud global,https://unciencia.unc.edu.ar/podcasts/entender-la-salud-global/,https://unciencia.unc.edu.ar/wp-content/blogs.dir/31/files/sites/4/2021/06/13-Salud-Integral-OMS-02-encab-1024x277.jpg,Producción audiovisual,Podcast,2021,0.22303,,,,,,"En un mundo en pandemia&#x2c; en un mundo en crisis sanitaria, la salud es una cuestión prioritaria. Según la OMS, el estado de salud no es solamente la ausencia de una enfermedad o dolencia, sino un completo bienestar físico, mental y social. ¿Cuáles son las dimensiones más importantes de la  salud?",,00:16:22,982,https://unciencia.unc.edu.ar/wp-content/blogs.dir/31/files/sites/4/2021/06/unciencia-podcast-salud.mp3,"Dialogamos con Victoria Mendizábal - Bióloga&#x2c; doctora en Farmacología, profesora del Seminario Ciencia y Salud de la Facultad de Ciencias de la Comunicación de la UNC"
a-028,Consumos problemáticos en adolescentes y jóvenes,https://unciencia.unc.edu.ar/podcasts/consumos-problematicos-en-adolescentes-y-jovenes/,https://unciencia.unc.edu.ar/wp-content/blogs.dir/31/files/sites/4/2021/06/Untitled-1024x213.jpg,Producción audiovisual,Podcast,2021,0.296389,,,,,,"Diferentes estudios señalan que&#x2c; en Córdoba, este grupo poblacional consume drogas recreativas a edades cada vez más tempranas. Entre estas sustancias se encuentran el alcohol&#x2c; el tabaco y la marihuana, y su abuso se ve propiciado por una baja percepción de los riesgos que entrañan. ¿Qué factores propician el consumo y cómo deben actuar las personas adultas responsables ante esto? ",,00:21:45,1305,https://unciencia.unc.edu.ar/wp-content/blogs.dir/31/files/sites/4/2021/06/unciencia-podcast-consumo-alcohol-jovenes.mp3,Dialogamos con Angelina Pilatti - Profesora Asistente en la Facultad de Psicología (UNC) e investigadora del Conicet. Trabaja en el Instituto de Investigaciones Psicológicas (IIPsi)
a-029,Parque Nacional Ansenuza: un sitio clave para conservar la biodiversidad,https://unciencia.unc.edu.ar/podcasts/parque-nacional-ansenuza-un-sitio-clave-para-conservar-la-biodiversidad/,https://unciencia.unc.edu.ar/wp-content/blogs.dir/31/files/sites/4/2021/05/marchiquita-1024x213.jpg,Producción audiovisual,Podcast,2021,0.148081,,,,,,"La creación del Parque Nacional Ansenuza abarcará la laguna de Mar Chiquita y los Bañados del Río Dulce&#x2c; un gran humedal considerado como un sitio clave para la conservación de la biodiversidad a nivel mundial. Será un área protegida con aproximadamente 900 mil hectáreas y comprende una gran diversidad de ambientes. Allí se encuentra&#x2c; además, el 66% de todas las especies de aves migratorias y playeras registradas para Argentina.  ",,00:10:52,652,https://unciencia.unc.edu.ar/wp-content/blogs.dir/31/files/sites/4/2021/05/unciencia-podcast-parque-ansenuza.mp3,Dialogamos con Walter Cejas - Biólogo del Museo de Zoología de la UNC. Actualmente trabaja en la zona&#x2c; investigando sobre aves migratorias y playeras
a-030,Malvinas y la Antártida desde una mirada geopolítica,https://unciencia.unc.edu.ar/podcasts/malvinas-y-la-antartida-desde-una-mirada-geopolitica/,https://unciencia.unc.edu.ar/wp-content/blogs.dir/31/files/sites/4/2021/05/12-Islas-Malvinas-Importancia-territorial-encabezado-02-1024x277.jpg,Producción audiovisual,Podcast,2021,0.265047,,,,,,"En 2022 se cumplen 40 años de la Guerra de Malvinas. A pesar de los procesos de descolonización que siguieron a la Segunda Guerra Mundial&#x2c; Malvinas permanece como un estandarte del imperio británico. Se trata de un territorio estratégico desde lo geopolítico, importante desde lo económico e imprescindible desde lo ecológico.",,00:19:27,1167,https://unciencia.unc.edu.ar/wp-content/blogs.dir/31/files/sites/4/2021/05/unciencia-podcast-islas-malvinas.mp3,"Dialogamos con Luciana Buffalo y Paola Seminara [Departamento de Geografia – Facultad de Filosofia y Humanidades (UNC), y Juan Cruz Margueliche e Hilario Patronelli [Departamento de Geografía. Facultad de Humanidades y Ciencias de la Educación, Universidad Nacional de La Plata]"
a-031,¿A dónde se irán los cerros?,https://unciencia.unc.edu.ar/podcasts/a-donde-se-iran-los-cerros/,https://unciencia.unc.edu.ar/wp-content/blogs.dir/31/files/sites/4/2021/05/11-Mineria-a-Cielo-Abierto-02-1024x277.jpg,Producción audiovisual,Podcast,2021,0.164206,,,,,,"Históricamente en Córdoba se ha realizado explotación minera de cantera&#x2c; pero en los últimos años la escala ha aumentado exponencialmente. Junto a Guillermina Díaz&#x2c; investigadora de la Universidad de  Río Cuarto, el geógrafo Joaquín Deón analizó el impactos y las disputas que genera la producción megaminera de canteras en las Sierras de Córdoba. ",,00:12:03,723,https://unciencia.unc.edu.ar/wp-content/blogs.dir/31/files/sites/4/2021/05/unciencia-podcast-megamineria.mp3,Dialogamos con Joaquín Deón - Geógrafo. Doctorando en Estudios Urbano-Regionales. Bauhaus-Universität-Weimar-FAUD-FFyH-UNC. Doctorando en Estudios Sociales Agrarios CEA-UNC. Becario CONICET-CIECS-UNC
a-032,Los relatos de la pandemia: una mirada desde el psicoanálisis,https://unciencia.unc.edu.ar/podcasts/los-relatos-de-la-pandemia-una-mirada-desde-el-psicoanalisis/,https://unciencia.unc.edu.ar/wp-content/blogs.dir/31/files/sites/4/2021/05/10-Relatos-sobre-la-realidad-01-encabezado-1024x277.jpg,Producción audiovisual,Podcast | Pandemia,2021,0.270952,,,,,,"La realidad no es un hecho dado brindado simplemente por los sentidos. Necesita del lenguaje, el discurso y la cultura para articularse como una realidad propiamente humana. Por ello diferentes actores sociales&#x2c; como los medios de comunicación o las redes sociales&#x2c; participan en una lucha para determinar qué es la realidad&#x2c; cuál es su sentido y cómo se han de ubicar los sujetos frente a ella. En el caso de la pandemia&#x2c; circulan diferentes relatos de sentidos opuestos.",,00:19:53,1193,https://unciencia.unc.edu.ar/wp-content/blogs.dir/31/files/sites/4/2021/04/unciencia-podcast-pandemia-y-psicoanalisis.mp3,Dialogamos con Alexis Morales&#x2c; profesor de la Cátedra de Psicoanálisis de la Facultad de Psicología de la UNC
a-033,Voces comechingonas en la Córdoba actual,https://unciencia.unc.edu.ar/podcasts/voces-comechingonas-en-la-cordoba-actual/,https://unciencia.unc.edu.ar/wp-content/blogs.dir/31/files/sites/4/2021/04/09-Comechingones-voces-actuales-1024x277.jpg,Producción audiovisual,Podcast,2021,0.131955,,,,,,"Los miembros de las comunidades originarias reivindican su existencia de forma continua desde tiempos ancestrales hasta la actualidad. Su historia se contrapone a la memoria oficial sobre estas comunidades que hoy&#x2c; organizadas y en lucha, disputan su lugar en la sociedad. En primera persona&#x2c; miembros de las comunidades comechingonas de La Toma –de la ciudad de Córdoba–, Timoteo Reyna y Chavascate –ambas de Villa Cerro Azul–, y Las Palmas –del Paraje Santa Teresita Sierra de Pocho– ponen en palabras las marcas que la política de invisibilización del Estado dejaron en sus historias familiares. UNCiencia podcast recupera sus voces a partir de registros tomados para el documental Canchira&#x2c; la huella del Comechingón, realizado por la UNC. ",,00:09:41,581,https://unciencia.unc.edu.ar/wp-content/blogs.dir/31/files/sites/4/2021/04/unciencia-podcast-comechingones-en-cordoba.mp3,Dialogamos con Pablo Reyna - Profesor y Licenciado en Historia. Miembro de la Comunidad Comechingona Henen Camiare Timoteo Reyna
