uid,title,url,image,contenttype,serie,year,normalized,characters,firstparagraph,allpixels,paperpixels,paintedpixels,description,country,duration,seconds,mp3,interviews
t-001,Los incendios reducirían entre 50 y 100 años la vida útil de los embalses en Córdoba,https://unciencia.unc.edu.ar/medioambiente/los-incendios-reducirian-entre-50-y-100-anos-la-vida-util-de-los-embalses-en-cordoba/,https://unciencia.unc.edu.ar/wp-content/blogs.dir/4/files/sites/4/2014/12/los-incendios-reducen-entre-50-y-100-anhos-la-vida-util-de-los-embalses-en-cordoba.jpg,Artículos,Medioambiente,2014,0.305298,8044.0,El fuego ocasiona la pérdida de materia orgánica&#x2c; disminuye la absorción del suelo y así aumenta la circulación del agua en las cuencas de drenaje. El resultado: mayor traslado y acumulación de cenizas y sedimentos en esos reservorios&#x2c; lo que reduce su capacidad de almacenamiento. La investigación de la UNC se enfocó en los embalses San Roque y Los Molinos&#x2c; que proveen de agua para consumo a la capital provincial. [10.12.2014],,,,,,,,,
t-002,Desarrollan biosensores con nanopartículas para detectar glucosa en sangre,https://unciencia.unc.edu.ar/innovacion/desarrollan-biosensores-con-nanoparticulas-para-detectar-glucosa-en-sangre/,https://unciencia.unc.edu.ar/wp-content/blogs.dir/31/files/sites/4/2014/12/UNCiencia_Biosensores_de_Glucosa-031-1024x503.jpg,Artículos,Innovación,2014,0.459048,12095.0,Fue ideado por un equipo interdisciplinario y permite detectar indirectamente la presencia y cantidad de glucosa en una muestra. Se utiliza dentro de un dispositivo estándar para el análisis de reacciones electroquímicas. La clave radica en las nanopartículas de magnetita recubiertas con carbono&#x2c; cuya producción demandó que las investigadoras utilizaran un método simple y de bajo costo de obtención. Por ahora&#x2c; es una innovación de gran sensibilidad y rapidez que se aplica en mediciones experimentales de laboratorio. [03.12.2014],,,,,,,,,
t-003,"Doctor, no quiero vacunar a mis hijos ¿Qué hago?",https://unciencia.unc.edu.ar/salud/doctor-no-quiero-vacunar-a-mis-hijos-que-hago/,https://unciencia.unc.edu.ar/wp-content/blogs.dir/31/files/sites/4/2014/12/vacunacion-1024x503.jpg,Artículos,Salud,2014,0.229847,6056.0,El siglo XX fue una gran época para la salud pública. Los avances científicos y tecnológicos no solo mejoraron nuestra calidad de vida&#x2c; también permitieron extender su expectativa: en América Latina&#x2c;según un informe de la Organización Panamericana de la Salud&#x2c; la esperanza de vida pasó de 29 años en 1900 a 74 años en 2010. [03.12.2014],,,,,,,,,
t-004,Descubren cómo reducir las dosis de morfina sin atenuar su efecto analgésico,https://unciencia.unc.edu.ar/salud/descubren-como-reducir-las-dosis-de-morfina-sin-atenuar-su-efecto-analgesico/,https://unciencia.unc.edu.ar/wp-content/blogs.dir/31/files/sites/4/2014/11/UNCiencia_tratamiento_innovador_para_el_dolor_morfina_omega3-011-1024x503.jpg,Artículos,Salud,2014,0.212502,5599.0,Tratamiento del dolor | La clave está en combinar ese fármaco con ácidos grasos Omega 3. El nuevo compuesto –cuya patente ya se encuentra en trámite– fue testeado con éxito en animales de laboratorio: mantuvo su potencial calmante sin generar tolerancia. Actualmente cierran los detalles de un convenio con una institución cordobesa para realizar pruebas clínicas en pacientes oncológicos. [12.11.2014],,,,,,,,,
t-005,"El sur de la ciudad de Córdoba, cada vez más fragmentado",https://unciencia.unc.edu.ar/geografia/el-sur-de-la-ciudad-de-cordoba-cada-vez-mas-fragmentado/,https://unciencia.unc.edu.ar/wp-content/blogs.dir/31/files/sites/4/2014/11/UNCiencia_conflictos_Zona_Sur_011-1024x503.jpg,Artículos,Geografía,2014,0.238386,6281.0,Ese sector se expande principalmente en forma dispersa y con baja densidad poblacional&#x2c; situación promovida mayormente por el desarrollo de urbanizaciones residenciales cerradas o privadas en áreas originalmente dedicadas a la producción agrícola. El fenómeno implica la reducción de la superficie del “cinturón verde”&#x2c; dedicado a la explotación frutihortícola&#x2c; y conlleva un incremento de los costos para extender la infraestructura de servicios urbanos. Los investigadores proponen trabajar en una planificación participativa donde intervengan empresarios&#x2c; sindicatos y universidades&#x2c; junto con el Estado. [05.11.2014],,,,,,,,,
t-006,"Los comentarios sexistas, la expresión más común de la violencia de género entre los universitarios",https://unciencia.unc.edu.ar/genero/los-comentarios-sexistas-la-expresion-mas-comun-de-la-violencia-de-genero-entre-los-universitarios/,https://unciencia.unc.edu.ar/wp-content/blogs.dir/4/files/sites/4/2014/10/los-comentarios-sexistas-la-expresion-mas-comun-de-la-violencia-de-genero-entre-los-universitarios.jpg,Artículos,Género,2014,0.197093,5193.0,La afirmación es resultado de un trabajo de investigación que encuestó de manera online a 950 estudiantes que cursan en las diferentes unidades académicas. Advierte que la violencia verbal o simbólica cuenta con mayor grado de naturalización e invisibilización&#x2c; al tiempo que parece ser más tolerada y estar sostenida socialmente. Proponen incluir formación en género dentro de los planes de estudio de todas las carreras. [29.10.2014],,,,,,,,,
t-007,"Cementerios, donde la memoria no descansa",https://unciencia.unc.edu.ar/arquitectura/cementerios-donde-la-memoria-no-descansa/,https://unciencia.unc.edu.ar/wp-content/blogs.dir/31/files/sites/4/2014/10/UNCiencia_Cementerios_071-1024x503.jpg,Artículos,Arquitectura,2014,0.224457,5914.0,Estas “ciudades de los muertos” son una representación simbólica de la sociedad donde están asentadas. Son espacios donde se ponen de manifiesto los modos en que la muerte es percibida en un momento histórico determinado. En ese sentido&#x2c; forman parte de la memoria urbana&#x2c; y recorrerlos permite acceder a la identidad de una comunidad. [29.10.2014],,,,,,,,,
t-008,Récord de avistamientos de la ballena franca austral en Península Valdés,https://unciencia.unc.edu.ar/biologia/record-de-avistamientos-de-la-ballena-franca-austral-en-peninsula-valdes/,https://unciencia.unc.edu.ar/wp-content/blogs.dir/31/files/sites/4/2014/10/UNCiencia_Ballena_Franca_Austral_011-1024x503.jpg,Artículos,Biología,2014,0.431987,11382.0,A través de un relevamiento fotográfico aéreo&#x2c; científicos argentinos contabilizaron 757 ballenas en el mar argentino que baña las costas de ese enclave en la provincia de Chubut&#x2c; Argentina. Es el mayor número de animales observados desde 1971&#x2c; cuando el Instituto de Conservación de Ballenas y Ocean Alliance comenzaron esa labor de identificación. En lo que va de 2014&#x2c; también registraron 255 nacimientos y 17 muertes. [22.10.2014],,,,,,,,,
t-009,Idean un dispositivo para el saneamiento de lagunas artificiales,https://unciencia.unc.edu.ar/innovacion/idean-un-dispositivo-para-el-saneamiento-de-lagunas-artificiales/,https://unciencia.unc.edu.ar/wp-content/blogs.dir/31/files/sites/4/2014/10/UNCiencia_Saneamiento_Lagunas-021-1024x503.jpg,Artículos,Innovación,2014,0.242295,6384.0,Es un equipo flotante móvil que absorbe el agua de la superficie y retiene la materia orgánica suspendida mediante un sistema de filtros. Puede ser operado de manera remota y tiene un bajo costo de mantenimiento. Fue diseñado como trabajo final de su carrera por dos estudiantes de Diseño Industrial de la UNC. Los jóvenes focalizaron su trabajo en la laguna del Parque Sarmiento&#x2c; uno de los espacios verdes más importantes de la ciudad de Córdoba&#x2c; pero puede ser utilizado en estanques de barrios cerrados y parques públicos de todo el país. [22.10.2014],,,,,,,,,
t-010,Diseñan un film ocular bioadhesivo para el tratamiento del glaucoma,https://unciencia.unc.edu.ar/oftalmologia/disenan-un-film-ocular-bioadhesivo-para-el-tratamiento-del-glaucoma/,https://unciencia.unc.edu.ar/wp-content/blogs.dir/4/files/sites/4/2014/10/disenhan-un-film-ocular-bioadhesivo-para-el-tratamiento-del-glaucoma.jpg,Artículos,Oftalmología,2014,0.245028,6456.0,Se trata de una película elaborada con diferentes polímeros biocompatibles que se coloca sobre el ojo y libera gradualmente un fármaco contra esa enfermedad&#x2c; identificada como una de las causas más comunes de ceguera irreversible. El nuevo dispositivo terapéutico&#x2c; recientemente patentado&#x2c; asegura la llegada de la droga al interior del ojo sin afectar la visión&#x2c; ni generar irritación. Aunque resta probarlo en humanos&#x2c; los resultados en animales fueron exitosos. [15.10.2014],,,,,,,,,
t-011,Instalarán en la UNC el primer radar meteorológico de producción nacional,https://unciencia.unc.edu.ar/tecnologia/instalaran-en-la-unc-el-primer-radar-meteorologico-de-produccion-nacional/,https://unciencia.unc.edu.ar/wp-content/blogs.dir/31/files/sites/4/2014/10/UNCiencia_RMA1_radar_meteorologico-cba-061-1024x503.jpg,Artículos,Tecnología,2014,0.270912,7138.0,Estará montado a mediados de noviembre en la Ciudad Universitaria. Constituye un paso fundamental hacia la concreción del Sistema Nacional de Radares Meteorológicos. Fue desarrollado por Invap y además de colaborar en el pronóstico y descripción del tiempo&#x2c; permitirá prevenir diferentes contingencias ambientales como crecidas repentinas de los ríos&#x2c; caída de granizo o la ocurrencia de tormentas severas. Entre otras aplicaciones también brindará mayor seguridad a la aeronavegación. [08.10.2014],,,,,,,,,
t-012,La mayoría de los estudiantes de Medicina y Abogacía de la UNC están a favor de la eutanasia,https://unciencia.unc.edu.ar/sociedad/la-mayoria-de-los-estudiantes-de-medicina-y-abogacia-de-la-unc-estan-a-favor-de-la-eutanasia/,https://unciencia.unc.edu.ar/wp-content/blogs.dir/4/files/sites/4/2014/10/la-mayoria-de-los-estudiantes-de-medicina-y-abogacia-de-la-unc-estan-a-favor-de-la-eutanasia.jpg,Artículos,Sociedad,2014,0.268977,7087.0,El dato surge de un estudio cuantitativo desarrollado por investigadores de la Facultad de Derecho y Ciencias Sociales. Participaron 552 universitarios de ambas carreras&#x2c; en su mayoría católicos. El 58% de los encuestados manifestó actitudes a favor de la eutanasia. En 2012&#x2c; Córdoba sancionó la ley de «Voluntad Anticipada y Muerte Digna». En mayo de este año se reunió por primera vez la Comisión Consultiva Interdisciplinaria que elaborará el anteproyecto para su reglamentación. [01.10.2014],,,,,,,,,
t-013,"El incremento de las lluvias, el cambio climático más importante en el centro de Argentina",https://unciencia.unc.edu.ar/medioambiente/el-incremento-de-las-lluvias-el-cambio-climatico-mas-importante-en-el-centro-de-argentina/,https://unciencia.unc.edu.ar/wp-content/blogs.dir/31/files/sites/4/2014/09/UNCiencia_Incremento_lluvias-041-1024x503.jpg,Artículos,Medioambiente,2014,0.204304,5383.0,Así lo revela un estudio que analizó los datos de temperatura y precipitaciones registrados entre 1941 y 2010. Las estadísticas fueron proporcionadas por el Servicio Meteorológico Nacional y corresponden a relevamientos efectuados en 44 estaciones&#x2c; distribuidas en las provincias de Córdoba&#x2c; San Luis&#x2c; Santa Fe&#x2c; La Rioja&#x2c; La Pampa y Buenos Aires. El trabajo reconoce que el fenómeno atenuó significativamente la aridez de la región central del país e incide en el avance de la frontera agrícola. [24.09.2014],,,,,,,,,
t-014,Kornblihtt: “Creo más en el compromiso social del científico que en la importancia social de su tema de investigación”,https://unciencia.unc.edu.ar/ciencia/kornblihtt-creo-mas-en-el-compromiso-social-del-cientifico-que-en-la-importancia-social-de-su-tema-de-investigacion/,https://unciencia.unc.edu.ar/wp-content/blogs.dir/31/files/sites/4/2014/09/UNCiencia_Alberto_Kornblihtt-05-1-1024x503.jpg,Artículos,Ciencia,2014,0.431646,11373.0,El reconocido biólogo molecular argentino concibe el trabajo del investigador como “parte de una militancia”&#x2c; y asegura que los científicos deben asumir el compromiso con la sociedad que financia la posibilidad de hacer ciencia. En esta entrevista&#x2c; Alberto Kornblihtt analiza la realidad actual de la ciencia argentina&#x2c; las tensiones entre la investigación básica y aplicada&#x2c; el debate alrededor del vínculo entre el sistema científico y productivo&#x2c; y el rol que debe asumir el Estado en ese proceso. [17.09.2014],,,,,,,,,
t-015,Confirman la circulación del virus de la Hepatitis E en Córdoba,https://unciencia.unc.edu.ar/salud/confirman-la-circulacion-del-virus-de-la-hepatitis-e-en-cordoba/,https://unciencia.unc.edu.ar/wp-content/blogs.dir/31/files/sites/4/2014/09/UNCiencia_Hepatitis_E-06-1-1024x503.jpg,Artículos,Salud,2014,0.247837,6530.0,Se transmite por vía fecal-oral y puede desencadenar hepatitis aguda&#x2c; aunque la mayoría de las veces la enfermedad se presenta sin síntomas. Un estudio analizó muestras del río Suquía&#x2c; de residuos cloacales y de un banco de suero humano conformado a partir de extracciones realizadas años atrás a vecinos sanos de prácticamente todos los barrios de la ciudad. ¿El resultado? El 4&#x2c;4% de la población estuvo alguna vez en contacto con este virus. [17.09.2014],,,,,,,,,
t-016,Desarrollan un test para la detección temprana de la dislexia,https://unciencia.unc.edu.ar/psicologia/desarrollan-un-test-para-la-deteccion-temprana-de-la-dislexia/,https://unciencia.unc.edu.ar/wp-content/blogs.dir/31/files/sites/4/2014/09/UNCiencia_test_dislexia_02-1-1024x503.jpg,Artículos,Psicología,2014,0.322188,8489.0,La herramienta evalúa la velocidad de lectura en niños de corta edad. Es la primera en su tipo diseñada en el país y fue realizada por un equipo de psicólogos de la UNC. Busca identificar tempranamente indicadores de ese trastorno de aprendizaje&#x2c; que suele pasar desapercibido o ser mal diagnosticado y cuya consecuencia más común es el bajo rendimiento académico. A nivel mundial&#x2c; entre el 10 y el 15 por ciento de la población escolar sufre este trastorno. En Argentina&#x2c; afectaría a más de 400 mil alumnos de primaria. [10.09.2014],,,,,,,,,
t-017,Los derechos de los reclusos en las cárceles de Córdoba,https://unciencia.unc.edu.ar/derechos-humanos/los-derechos-de-los-reclusos-en-las-carceles-de-cordoba/,https://unciencia.unc.edu.ar/wp-content/blogs.dir/31/files/sites/4/2014/09/UNCiencia_Situacion_de_encierro-011-1024x503.jpg,Artículos,Derechos humanos,2014,0.308638,8132.0,El sistema penitenciario provincial no logra asegurar el acceso al trabajo&#x2c; a la educación&#x2c; a la salud&#x2c; a la recreación y a la propia integridad psicofísica de las personas privadas de la libertad. El dato surge de un informe de monitoreo elaborado por organizaciones sociales&#x2c; dependencias del estado provincial y universidades nacionales de Córdoba&#x2c; que será presentado mañana&#x2c; 4 de septiembre&#x2c; en el marco de la Feria del Libro. [03.09.2014],,,,,,,,,
t-018,Novedoso detector de venas no invasivo,https://unciencia.unc.edu.ar/innovacion/novedoso-detector-de-venas-no-invasivo/,https://unciencia.unc.edu.ar/wp-content/blogs.dir/31/files/sites/4/2014/09/RKsfWmRi-1024x503.jpg,Artículos,Innovación,2014,0.272848,7189.0,El aparato médico permite encontrar fácilmente los vasos sanguíneos en personas de difícil acceso venoso. Funciona con luz infrarroja y está destinado a pacientes bajo tratamiento de quimioterapia intravenosa y hemodiálisis&#x2c; aunque puede tener un uso general. Está pensado para ser producido en su totalidad con componentes locales y su costo total por unidad es de 1.600 pesos. En el mercado existen otros sistemas de visión artificial de venas&#x2c; pero ninguno es de producción nacional. Es un desarrollo de dos egresadas de la carrera de Diseño Industrial de la UNC que ya recibió reconocimiento internacional. [27.08.2014],,,,,,,,,
t-019,Analizan 20 mil documentos de la dictadura con un software desarrollado por expertos en computación,https://unciencia.unc.edu.ar/derechos-humanos/analizan-20-mil-documentos-de-la-dictadura-con-un-software-desarrollado-por-expertos-en-computacion/,https://unciencia.unc.edu.ar/wp-content/blogs.dir/31/files/sites/4/2021/03/Digitalizacion_archivos-APM-051-1024x503.jpg,Artículos,Derechos humanos,2014,0.235881,6215.0,Con un programa de reconocimiento óptico de caracteres y autocorrección creado a medida&#x2c; especialistas procesan un lote de registros conservados en el Archivo Provincial de la Memoria. La iniciativa&#x2c; pionera en Argentina&#x2c; apunta a extraer información de personas&#x2c; lugares y fechas para facilitar su sistematización y el establecimiento de relaciones en la búsqueda de datos que permitan clarificar los delitos de lesa humanidad cometidos en los centros clandestinos de detención. Los resultados pueden aportar pruebas en los Juicios por la Verdad que se desarrollan en distintas provincias. [20.08.2014],,,,,,,,,
t-020,Argentina podría sustituir la importación de combustibles con la producción de hidrógeno,https://unciencia.unc.edu.ar/medioambiente/argentina-podria-sustituir-la-importacion-de-combustibles-con-la-produccion-de-hidrogeno/,https://unciencia.unc.edu.ar/wp-content/blogs.dir/31/files/sites/4/2014/08/UNCiencia_Potencial_Hidrogeno_Argentina-011-1024x503.jpg,Artículos,Medioambiente,2014,0.447017,11778.0,En 2010 se importaron más de 1&#x2c;6 millones de m3 de nafta y gasoil por un total de 968 millones de dólares. El país podría reemplazar estas importaciones con sólo utilizar el 10% de las tierras aptas para proyectos de energías renovables distribuidas en todo el territorio. El dato surge de un estudio de factibilidad que analiza el potencial nacional para la producción de hidrógeno a partir de las energías eólica&#x2c; solar y de biomasa. [14.08.2014],,,,,,,,,
t-021,Así se construye la primera minoría religiosa de Argentina,https://unciencia.unc.edu.ar/sociedad/asi-se-construye-la-primera-minoria-religiosa-de-argentina/,https://unciencia.unc.edu.ar/wp-content/blogs.dir/31/files/sites/4/2014/08/UNCiencia_1ra_minoria_religiosa-011-1024x503.jpg,Artículos,Sociedad,2014,0.200509,5283.0,El movimiento evangélico se ha afianzado y expandido en el país. Actualmente representa el nueve por ciento de la población. Una investigación realizada en la localidad Malvinas Argentinas&#x2c; de la provincia de Córdoba&#x2c; da cuenta de las diversas prácticas que influyen en el crecimiento de esta creencia. [14.08.2014],,,,,,,,,
t-022,Las estrellas del sur tienen un nuevo espejo donde contemplarse,https://unciencia.unc.edu.ar/astronomia/las-estrellas-del-sur-tienen-un-nuevo-espejo-donde-contemplarse/,https://unciencia.unc.edu.ar/wp-content/blogs.dir/31/files/sites/4/2014/08/unciencia_aluminizacion_espejo_bosque_alegre_5801-1024x503.jpg,Artículos,Astronomía,2014,0.449142,11834.0,Técnicos del Observatorio Astronómico de Córdoba aluminizaron el espejo del telescopio mayor ubicado en la Estación Astrofísica de Bosque Alegre. Es un procedimiento al que debe someterse periódicamente la óptica de 1&#x2c;54 metros de diámetro para mantener su reflectividad y asegurar así la máxima calidad de la imagen durante las observaciones. La tarea demandó tres días de trabajo y es una conjunción de pasión&#x2c; ingenio&#x2c; conocimientos heredados e innovaciones de urgencia. Esta puesta a punto deja al segundo telescopio más importante de Argentina en óptimas condiciones para futuros proyectos científicos. [07.08.2014],,,,,,,,,
t-023,Gabriel Rabinovich: “En ciencia es muy importante equivocarse”,https://unciencia.unc.edu.ar/ciencia/gabriel-rabinovich-en-ciencia-es-muy-importante-equivocarse/,https://unciencia.unc.edu.ar/wp-content/blogs.dir/31/files/sites/4/2014/08/UNCiencia_Gabriel_Rabinovich-011-1024x503.jpg,Artículos,Ciencia,2014,0.603803,15909.0,El científico argentino&#x2c; reconocido mundialmente por sus aportes al estudio y tratamiento del cáncer&#x2c; asegura que los desaciertos durante la investigación son tan necesarios como los aciertos. En diálogo con UNCiencia&#x2c; señala que los mejores resultados se obtienen recogiendo los talentos individuales del trabajo en equipo&#x2c; y dentro del sector público. Además&#x2c; destaca que en la última década se logró la jerarquización de la ciencia en el país y reclama continuidad en las políticas públicas implementadas hasta ahora. [07.08.2014],,,,,,,,,
t-024,De los videojuegos a los cálculos científicos,https://unciencia.unc.edu.ar/computacion/de-los-videojuegos-a-los-calculos-cientificos/,https://unciencia.unc.edu.ar/wp-content/blogs.dir/31/files/sites/4/2021/02/UNCiencia_Centro_Computos_Alto_Rendimiento-011-1024x503.jpg,Artículos,Computación,2014,0.255276,6726.0,Las supercomputadoras se convirtieron en herramientas vitales para la ciencia por su capacidad para realizar cálculos con volúmenes gigantescos de datos. Semanas atrás&#x2c; la UNC triplicó la capacidad de cómputo de su mejor máquina&#x2c; apodada “Mendieta”&#x2c; hasta los 29 teraflops&#x2c; es decir&#x2c; 29 billones de operaciones con números reales por segundo. ¿La clave? Usan tarjetas gráficas muy similares a las que traen las consolas hogareñas de videojuegos&#x2c; pero conectadas entre sí. [30.07.2014],,,,,,,,,
t-025,Diseñan un test psicológico para diagnosticar la tecnoadicción,https://unciencia.unc.edu.ar/psicologia/disenan-un-test-psicologico-para-diagnosticar-la-tecnoadiccion/,https://unciencia.unc.edu.ar/wp-content/blogs.dir/31/files/sites/4/2014/07/UNCIENCIA_Tecnoadictos-031-1024x503.jpg,Artículos,Psicología,2014,0.367922,9694.0,La herramienta evalúa el uso abusivo y patológico de las computadoras&#x2c; internet&#x2c; videojuegos&#x2c; telefonía móvil y de tecnología en general. Entre los factores personales que promueven la tecnodependencia convergen problemas como la depresión&#x2c; la ansiedad y la soledad; los rasgos de una personalidad impulsiva&#x2c; rígida e introvertida; y la influencia de la cultura consumista aunada al abaratamiento de costos de los dispositivos y su carácter perecedero. El instrumento ya se aplica en estudios descriptivos. [23.07.2014],,,,,,,,,
t-026,"“Los quince”, un ritual que no pierde vigencia",https://unciencia.unc.edu.ar/etnografia/los-quince-un-ritual-que-no-pierde-vigencia/,https://unciencia.unc.edu.ar/wp-content/blogs.dir/31/files/sites/4/2014/07/los15-1024x503.jpg,Artículos,Etnografía,2014,0.224267,5909.0,El festejo representa un hito importante en la vida de las adolescentes&#x2c; íntimamente ligado a la construcción de su identidad. En este artículo&#x2c; una mirada etnográfica sobre la experiencia donde se entrecruzan género&#x2c; clase&#x2c; familia&#x2c; mercado&#x2c; juventud&#x2c; generación y Estado. [23.07.2014],,,,,,,,,
t-027,Una batalla contra el envejecimiento,https://unciencia.unc.edu.ar/salud/una-batalla-contra-el-envejecimiento/,https://unciencia.unc.edu.ar/wp-content/blogs.dir/31/files/sites/4/2021/04/UNCIENCIA_inmunologia-1024x503.jpg,Artículos,Salud,2014,0.380826,10034.0,Científicos de la Facultad de Ciencias Químicas investigan cómo funciona el sistema inmune&#x2c; particularmente en organismos envejecidos. La clave es el CpG&#x2c; una sustancia que ayuda a mejorar la respuesta del cuerpo ante el ataque de microorganismos. Utilizando esta sustancia&#x2c; recientemente idearon una estrategia que permite aumentar el nivel de anticuerpos y la defensa celular&#x2c; un resultado alentador para el desarrollo de vacunas. Antes&#x2c; habían descubierto que al mezclar el CpG con una proteína específica&#x2c; los organismos viejos lograban defenderse tan bien como los jóvenes. [16.07.2014],,,,,,,,,
t-028,Las series de TV y los límites entre lo humano y lo animal,https://unciencia.unc.edu.ar/lenguas/las-series-de-tv-y-los-limites-entre-lo-humano-y-lo-animal/,https://unciencia.unc.edu.ar/wp-content/blogs.dir/4/files/sites/4/2014/07/las-series-de-tv-y-los-limites-entre-lo-humano-y-lo-animal.jpg,Artículos,Lenguas,2014,0.158342,4172.0,Hace varios años que las series norteamericanas de televisión se convirtieron en un objeto de consumo e incluso de culto masivo. Los vampiros de True blood&#x2c; los asesinatos selectivos de Dexter&#x2c; y un largo etcétera de personajes y temáticas&#x2c; ya pueden ser considerados parte de la cultura popular. [16.07.2014],,,,,,,,,
t-029,La peligrosa cercanía a los campos fumigados,https://unciencia.unc.edu.ar/salud/la-peligrosa-cercania-a-los-campos-fumigados/,https://unciencia.unc.edu.ar/wp-content/blogs.dir/4/files/sites/4/2014/07/evaluan-los-efectos-de-los-agroquimicos-en-el-interior-cordobes.jpg,Artículos,Salud,2014,0.181418,4780.0,Cuanto más cerca de las zonas donde se aplican pesticidas viven o trabajan las personas&#x2c; mayor es su riego de padecer enfermedades asociadas a intoxicaciones crónicas. Así lo demuestra un estudio del Instituto Superior de Estudios Ambientales (ISEA) de la UNC&#x2c; a partir de un trabajo de campo realizado en la localidad de Morrison&#x2c; en el sureste del territorio provincial. Entre las afecciones más frecuentes se ubicaron las de tipo ocular&#x2c; las cutáneas y los dolores de cabeza. También se detectó una elevada proporción de recién nacidos con bajo peso y de nacimientos antes de término. [10.07.2014],,,,,,,,,
